name,address,city,province,country,time_zone,latitude,longitude,facebook_url,instagram_url,viber_contact,website_url,other_contact_info,amenities,courts,photo_urls
The Upper Deck Sports,"Pasig, Metro Manila, Philippines",CITY OF PASIG,METRO MANILA,PH,Asia/Manila,,,,,,https://www.pickleheads.com/courts/ph/metro-manila/pasig/the-upper-deck-sports,,,pickleball|pickleball|,
Madras Sports Facility,"Paranaque, Metro Manila, Philippines",CITY OF PARAÑAQUE,METRO MANILA,PH,Asia/Manila,,,,,,https://www.pickleheads.com/courts/ph/metro-manila/paranaque/madras-sports-facility,,,pickleball|pickleball|,
Magnum Sports Complex,"Cebu City, Central Visayas, Philippines",CEBU CITY,CEBU,PH,Asia/Manila,,,,,,https://www.pickleheads.com/courts/ph/central-visayas/cebu-city/magnum-sports-complex,,,pickleball|pickleball|,
Canonigo Sports And Recreation Center,"Manila, Metro Manila, Philippines",MANILA,METRO MANILA,PH,Asia/Manila,,,,,,https://www.pickleheads.com/courts/ph/metro-manila/manila/canonigo-sports-and-recreation-center,,,pickleball|pickleball|,
Tito Vics Cafe And Sports Bar,"Bato, Eastern Visayas, Philippines",BATO,LEYTE,PH,Asia/Manila,,,,,,https://www.pickleheads.com/courts/ph/eastern-visayas/bato/tito-vics-cafe-and-sports-bar,,,pickleball|pickleball|,
South Cotabato Sports Complex,"Koronadal City, Soccsksargen, Philippines",KORONADAL CITY,SOUTH COTABATO,PH,Asia/Manila,,,,,,https://www.pickleheads.com/courts/ph/soccsksargen/koronadal-city/south-cotabato-sports-complex,,,pickleball|pickleball|,
Incredoball Sports And Development Center,"Dumaguete City, Negros Island Region, Philippines",DUMAGUETE CITY,NEGROS ORIENTAL,PH,Asia/Manila,,,,,,https://www.pickleheads.com/courts/ph/negros-island-region/dumaguete-city/incredoball-sports-and-development-center,,,pickleball|pickleball|,
Fpb Sports Complex,"Davao City, Davao Region, Philippines",DAVAO CITY,DAVAO DEL SUR,PH,Asia/Manila,,,,,,https://www.pickleheads.com/courts/ph/davao-region/davao-city/fpb-sports-complex,,,pickleball|pickleball|,
Actifit Sports Complex,"Valenzuela, Metro Manila, Philippines",CITY OF VALENZUELA,METRO MANILA,PH,Asia/Manila,,,,,,https://www.pickleheads.com/courts/ph/metro-manila/valenzuela/actifit-sports-complex,,,pickleball|pickleball|,
Village Sports Club,"Las Pinas, Metro Manila, Philippines",CITY OF LAS PIÑAS,METRO MANILA,PH,Asia/Manila,,,,,,https://www.pickleheads.com/courts/ph/metro-manila/las-pinas/village-sports-club,,,pickleball|pickleball|,
Sports Zone,"Cagayan De Oro, Northern Mindanao, Philippines",CAGAYAN DE ORO CITY,MISAMIS ORIENTAL,PH,Asia/Manila,,,,,,https://www.pickleheads.com/courts/ph/northern-mindanao/cagayan-de-oro/sports-zone,,,pickleball|pickleball|,
Manaoag Sports Complex,"Manaoag, Ilocos Region, Philippines",MANAOAG,PANGASINAN,PH,Asia/Manila,,,,,,https://www.pickleheads.com/courts/ph/ilocos-region/manaoag/manaoag-sports-complex,,,pickleball|pickleball|,
Hemady Sports Plaza,"Quezon City, Metro Manila, Philippines",QUEZON CITY,METRO MANILA,PH,Asia/Manila,,,,,,https://www.pickleheads.com/courts/ph/metro-manila/quezon-city/hemady-sports-plaza,,,pickleball|pickleball|,
Southside Pickleball And Tennis Club,"Silang, Calabarzon, Philippines",SILANG,CAVITE,PH,Asia/Manila,,,,,,https://www.pickleheads.com/courts/ph/calabarzon/silang/southside-pickleball-and-tennis-club,,,pickleball|pickleball|,
Country Village Hotel,"Cagayan De Oro City, Misamis Oriental, Philippines",CAGAYAN DE ORO CITY,MISAMIS ORIENTAL,PH,Asia/Manila,,,,,,https://www.pickleheads.com/courts/ph/northern-mindanao/cagayan-de-oro/country-village-hotel,,,pickleball|pickleball|,
Kalamandarin Pickleball Court,"Cabanatuan City, Nueva Ecija, Philippines",CABANATUAN CITY,NUEVA ECIJA,PH,Asia/Manila,,,,,,https://www.pickleheads.com/courts/ph/central-luzon/cabanatuan-city/kalamandarin-pickleball-court,,,pickleball|pickleball|,
Smash Cab Badminton And Fitness,"Cabanatuan City, Nueva Ecija, Philippines",CABANATUAN CITY,NUEVA ECIJA,PH,Asia/Manila,,,,,,https://www.pickleheads.com/courts/ph/central-luzon/cabanatuan-city/smash-cab-badminton-and-fitness,,,pickleball|pickleball|,
Match Point Badminton And Pickleball,"Liloan, Cebu, Philippines",LILOAN,CEBU,PH,Asia/Manila,,,,,,https://www.pickleheads.com/courts/ph/central-visayas/liloan/match-point-badminton-and-pickleball,,,pickleball|pickleball|,
Jolo Paddlers,"Jolo, Sulu, Philippines",JOLO,SULU,PH,Asia/Manila,,,,,,https://www.pickleheads.com/courts/ph/bangsamoro-autonomous-region-in-muslim-mindanao/jolo/jolo-paddlers,,,pickleball|pickleball|,
University Of The Philippines Visayas,"Miagao, Iloilo, Philippines",MIAGAO,ILOILO,PH,Asia/Manila,,,,,,https://www.pickleheads.com/courts/ph/western-visayas/miagao/university-of-the-philippines-visayas,,,pickleball|pickleball|,
South City Elementary School Mangnao Gym,"Dumaguete City, Negros Oriental, Philippines",DUMAGUETE CITY,NEGROS ORIENTAL,PH,Asia/Manila,,,,,,https://www.pickleheads.com/courts/ph/central-visayas/dumaguete/south-city-elementary-school-mangnao-gym,,,pickleball|pickleball|,
Upv City Campus Pickleball Court,"Iloilo City, Iloilo, Philippines",ILOILO CITY,ILOILO,PH,Asia/Manila,,,,,,https://www.pickleheads.com/courts/ph/western-visayas/iloilo-city/upv-city-campus-pickleball-court,,,pickleball|pickleball|,
Dona Faustina Village 1 Tennis Court,"Quezon City, Metro Manila, Philippines",QUEZON CITY,METRO MANILA,PH,Asia/Manila,,,,,,https://www.pickleheads.com/courts/ph/metro-manila/quezon-city/dona-faustina-village-1-tennis-court,,,pickleball|pickleball|,
Dona Juana Subdivision,"City of Pasig, Metro Manila, Philippines",CITY OF PASIG,METRO MANILA,PH,Asia/Manila,,,,,,https://www.pickleheads.com/courts/ph/metro-manila/pasig/dona-juana-subdivision,,,pickleball|pickleball|,
Sequoia Pickleball Club,"Taguig, Metro Manila, Philippines",TAGUIG,METRO MANILA,PH,Asia/Manila,,,,,,https://www.pickleheads.com/courts/ph/metro-manila/taguig/sequoia-pickleball-club,,,pickleball|pickleball|,
Acacia Pickleball Club,"Taguig, Metro Manila, Philippines",TAGUIG,METRO MANILA,PH,Asia/Manila,,,,,,https://www.pickleheads.com/courts/ph/metro-manila/taguig/acacia-pickleball-club,,,pickleball|pickleball|,
Ssclhs Pickleball Club,"Jolo, Sulu, Philippines",JOLO,SULU,PH,Asia/Manila,,,,,,https://www.pickleheads.com/courts/ph/bangsamoro-autonomous-region-in-muslim-mindanao/jolo/ssclhs-pickleball-club,,,pickleball|pickleball|,
Morning Mist Village,"Cagayan De Oro City, Misamis Oriental, Philippines",CAGAYAN DE ORO CITY,MISAMIS ORIENTAL,PH,Asia/Manila,,,,,,https://www.pickleheads.com/courts/ph/northern-mindanao/cagayan-de-oro-city/morning-mist-village,,,pickleball|pickleball|,
Camella Covered Court,"Cabanatuan City, Nueva Ecija, Philippines",CABANATUAN CITY,NUEVA ECIJA,PH,Asia/Manila,,,,,,https://www.pickleheads.com/courts/ph/central-luzon/cabanatuan-city/camella-covered-court,,,pickleball|pickleball|,
Fitness Hub,"Las Pinas, Metro Manila, Philippines",CITY OF LAS PIÑAS,METRO MANILA,PH,Asia/Manila,,,,,,https://www.pickleheads.com/courts/ph/metro-manila/las-pinas/fitness-hub,,,pickleball|pickleball|,
Lb Pickleball Club,"Manolo Fortich, Northern Mindanao, Philippines",MANOLO FORTICH,BUKIDNON,PH,Asia/Manila,,,,,,https://www.pickleheads.com/courts/ph/northern-mindanao/manolo-fortich/lb-pickleball-club,,,pickleball|pickleball|,
South Philippine Adventist College,"Matanao, Davao Region, Philippines",MATANAO,DAVAO DEL SUR,PH,Asia/Manila,,,,,,https://www.pickleheads.com/courts/ph/davao-region/matanao/south-philippine-adventist-college,,,pickleball|pickleball|,
Frnds Pickleball,"Sibulan, Central Visayas, Philippines",SIBULAN,NEGROS ORIENTAL,PH,Asia/Manila,,,,,,https://www.pickleheads.com/courts/ph/central-visayas/sibulan/frnds-pickleball,,,pickleball|pickleball|,
Mariano Marcos State University,"Batac, Ilocos Region, Philippines",BATAC CITY,ILOCOS NORTE,PH,Asia/Manila,,,,,,https://www.pickleheads.com/courts/ph/ilocos-region/batac/mariano-marcos-state-university,,,pickleball|pickleball|,
Sinadya Pickleball Courts At Vista Mall Iloilo,"Philippines, Western Visayas, Philippines",ILOILO CITY,ILOILO,PH,Asia/Manila,,,,,,https://www.pickleheads.com/courts/ph/western-visayas/philippines/sinadya-pickleball-courts-at-vista-mall-iloilo,,,pickleball|pickleball|,
Pickleball The Food Camp,"Lapu Lapu, Central Visayas, Philippines",LAPU-LAPU CITY (OPON),CEBU,PH,Asia/Manila,,,,,,https://www.pickleheads.com/courts/ph/central-visayas/lapu-lapu/pickleball-the-food-camp,,,pickleball|pickleball|,
Upv Miagao Pickleball Courts,"Miagao, Western Visayas, Philippines",MIAGAO,ILOILO,PH,Asia/Manila,,,,,,https://www.pickleheads.com/courts/ph/western-visayas/miagao/upv-miagao-pickleball-courts,,,pickleball|pickleball|,
Warriors Pickleball Club,"Trece Martires, Calabarzon, Philippines",TRECE MARTIRES CITY,CAVITE,PH,Asia/Manila,,,,,,https://www.pickleheads.com/courts/ph/calabarzon/trece-martires/warriors-pickleball-club,,,pickleball|pickleball|,
Realaks Pickleball Court,"Barili, Central Visayas, Philippines",BARILI,CEBU,PH,Asia/Manila,,,,,,https://www.pickleheads.com/courts/ph/central-visayas/barili/realaks-pickleball-court,,,pickleball|pickleball|,
Ccpc Bondoc Court,"Calapan, Mimaropa, Philippines",CITY OF CALAPAN,ORIENTAL MINDORO,PH,Asia/Manila,,,,,,https://www.pickleheads.com/courts/ph/mimaropa/calapan/ccpc-bondoc-court,,,pickleball|pickleball|,
The Pickleground Ph,"Kawit, Calabarzon, Philippines",KAWIT,CAVITE,PH,Asia/Manila,,,,,,https://www.pickleheads.com/courts/ph/calabarzon/kawit/the-pickleground-ph,,,pickleball|pickleball|,
Merville Pickleball Club,"Paranaque, Metro Manila, Philippines",CITY OF PARAÑAQUE,METRO MANILA,PH,Asia/Manila,,,,,,https://www.pickleheads.com/courts/ph/metro-manila/paranaque/merville-pickleball-club,,,pickleball|pickleball|,
Lds Pickleball,"Valenzuela, Metro Manila, Philippines",CITY OF VALENZUELA,METRO MANILA,PH,Asia/Manila,,,,,,https://www.pickleheads.com/courts/ph/metro-manila/valenzuela/lds-pickleball,,,pickleball|pickleball|,
Dumaguete City National High School Gym,"Dumaguete City, Negros Oriental, Philippines",DUMAGUETE CITY,NEGROS ORIENTAL,PH,Asia/Manila,,,,,,https://www.pickleheads.com/courts/ph/central-visayas/dumaguete/dumaguete-city-national-high-school-gym,,,pickleball|pickleball|,
Jasaan Town Plaza,"Jasaan, Misamis Oriental, Philippines",JASAAN,MISAMIS ORIENTAL,PH,Asia/Manila,,,,,,https://www.pickleheads.com/courts/ph/northern-mindanao/jasaan/jasaan-town-plaza,,,pickleball|pickleball|,
Robinsons Place Dumaguete,"Dumaguete City, Negros Oriental, Philippines",DUMAGUETE CITY,NEGROS ORIENTAL,PH,Asia/Manila,,,,,,https://www.pickleheads.com/courts/ph/central-visayas/dumaguete/robinsons-place-dumaguete,,,pickleball|pickleball|,
Bacnotan Pickleball Club,"Bacnotan, La Union, Philippines",BACNOTAN,LA UNION,PH,Asia/Manila,,,,,,https://www.pickleheads.com/courts/ph/ilocos-region/bacnotan/bacnotan-pickleball-club,,,pickleball|pickleball|,
Masey Pickleball,"Malay, Aklan, Philippines",MALAY,AKLAN,PH,Asia/Manila,,,,,,https://www.pickleheads.com/courts/ph/western-visayas/malay/masey-pickleball,,,pickleball|pickleball|,
Lmb Pickleball League,"Cotabato City, Maguindanao, Philippines",COTABATO CITY,MAGUINDANAO,PH,Asia/Manila,,,,,,https://www.pickleheads.com/courts/ph/soccsksargen/cotabato-city/lmb-pickleball-league,,,pickleball|pickleball|,
Pwr Pickleball Courts,"Dumaguete City, Negros Oriental, Philippines",DUMAGUETE CITY,NEGROS ORIENTAL,PH,Asia/Manila,,,,,,https://www.pickleheads.com/courts/ph/negros-island-region/dumaguete-city/pwr-pickleball-courts,,,pickleball|pickleball|,
Slv Courts,"Dumaguete City, Negros Oriental, Philippines",DUMAGUETE CITY,NEGROS ORIENTAL,PH,Asia/Manila,,,,,,https://www.pickleheads.com/courts/ph/negros-island-region/dumaguete-city/slv-courts,,,pickleball|pickleball|,
North South Pickleball Club,"Pasig, Metro Manila, Philippines",CITY OF PASIG,METRO MANILA,PH,Asia/Manila,,,,,,https://www.pickleheads.com/courts/ph/metro-manila/pasig/north-south-pickleball-club,,,pickleball|pickleball|,
Kai Multipurpose Hall,"Mandaluyong, Metro Manila, Philippines",CITY OF MANDALUYONG,METRO MANILA,PH,Asia/Manila,,,,,,https://www.pickleheads.com/courts/ph/metro-manila/mandaluyong/kai-multipurpose-hall,,,pickleball|pickleball|,
Picklebees Vmmc Uhtpc,"Quezon City, Metro Manila, Philippines",QUEZON CITY,METRO MANILA,PH,Asia/Manila,,,,,,https://www.pickleheads.com/courts/ph/metro-manila/quezon-city/picklebees-vmmc-uhtpc,,,pickleball|pickleball|,
